{
  "id": "role_07",
  "canonical_name": "Élise Morel",
  "role_type": "optional",
  "availability": {
    "compact_4_players": "not_used",
    "standard_6_players": "converted_to_collective_evidence",
    "extended_8_players": "active"
  },
  "culprit": false,
  "public_identity": {
    "title": "La journaliste sous couverture",
    "description": "Présentée comme chroniqueuse mondaine, venue en réalité enquêter sur la fondation, la succession et la vente du palace.",
    "public_relation_to_victim": "Invitée tolérée par Auguste, qui ignorait initialement l'objet exact de son enquête.",
    "apparent_motive": "Auguste avait découvert sa couverture et menaçait de la faire arrêter pour vol de documents.",
    "costume_cues": [
      "appareil photo",
      "carnet",
      "carte de presse dissimulée"
    ]
  },
  "casting": {
    "difficulty": "medium",
    "play_style": [
      "questions",
      "collecte d'informations",
      "révélation"
    ],
    "recommended_for": "Un joueur curieux qui aime provoquer les échanges et reconstruire une histoire cachée.",
    "organizer_friendly": true,
    "culprit_opt_in_recommended": false
  },
  "private_truth": {
    "relationship_to_victim": "Vous enquêtez depuis qu'un ancien comptable vous a parlé de l'effacement d'Émile Mercier et d'une vente précipitée.",
    "secret": "Vous êtes entrée sous un faux motif et avez photographié des pages du registre familial comme une ancienne plaque démontée.",
    "independent_secret": "Votre source a obtenu illégalement une copie partielle de l'annexe de 1919 et vous refusez de l'identifier.",
    "historical_stake": "Vous voulez démontrer comment une grande famille a transformé un partenariat en légende personnelle, puis tenté de vendre un bien dont le titre était contestable.",
    "claimed_alibi": "Vous dites avoir pris des photographies du gala toute la soirée.",
    "actual_timeline": [
      "À 16:32, vous photographiez une page montrant le nom Mercier et une incohérence de sceau.",
      "Vous tentez d'approcher la sacoche contenant l'acte authentique.",
      "À 21:42, Auguste vous surprend avec votre appareil et menace de vous faire arrêter après le gala.",
      "Vous comprenez néanmoins qu'il s'apprête lui-même à révéler une partie de l'affaire."
    ],
    "knowledge_limits": [
      "Vous ne savez pas qui a falsifié le codicille contemporain.",
      "Vous n'avez aucune information médicale fiable.",
      "Vous ignorez les déplacements précis de Camille pendant la première fenêtre du crime.",
      "Votre source ne possède qu'une copie partielle de l'annexe."
    ]
  },
  "gameplay": {
    "private_objective": "Obtenir une preuve publiable du vol historique sans livrer l'identité de votre source.",
    "secondary_objective": "Faire reconnaître que l'enquête sur le palace ne doit pas se transformer en accusation infondée de meurtre ancien.",
    "reason_to_lie": "Vous avez volé et photographié des documents, tenté d'intercepter un pli et subi une menace directe d'Auguste.",
    "suspect_axes": [
      "fausse identité",
      "vol de documents",
      "conflit avec Auguste",
      "accès aux dossiers",
      "publication du scandale Mercier"
    ],
    "allowed_lies": [
      "nier être journaliste",
      "dissimuler votre source",
      "minimiser les photographies prises",
      "prétendre avoir seulement enquêté sur la vente"
    ],
    "forbidden_inventions": [
      "fabriquer un article ou une photographie",
      "transformer la mort d'Émile en meurtre",
      "attribuer une déclaration à votre source sans carte prévue",
      "prétendre connaître la méthode du meurtre"
    ],
    "known_facts": [
      "Le registre de 1919 cite Émile Mercier comme partenaire.",
      "Le sceau du codicille contemporain ne correspond pas au registre notarial.",
      "Une copie complète de l'acte et de son annexe a été demandée à Genève.",
      "Auguste comptait rendre la fraude publique.",
      "Armand cherchait à conclure la vente avant toute contestation."
    ],
    "documents_held": [
      "photographie du registre",
      "photographie d'une plaque portant les deux noms",
      "carte de presse",
      "note anonyme de la source",
      "coupure de journal sur les reprises hôtelières"
    ]
  },
  "relationships": [
    {
      "target_role_id": "role_04",
      "public": "Source potentielle.",
      "private": "Vous pensez qu'il copie les dossiers d'Auguste et peut compléter vos archives."
    },
    {
      "target_role_id": "role_06",
      "public": "Figure financière à interviewer.",
      "private": "Vous enquêtez sur sa volonté de vendre avant clarification du titre."
    },
    {
      "target_role_id": "role_08",
      "public": "Invitée du gala.",
      "private": "Vous avez tenté d'approcher le pli qu'elle transporte."
    },
    {
      "target_role_id": "role_02",
      "public": "Directrice de l'établissement.",
      "private": "Vous pensez que son père est le fondateur effacé que vous recherchez."
    }
  ],
  "act_revelations": [
    {
      "act": 1,
      "class": "conditional",
      "trigger": "découverte d'une photographie ou de votre carte",
      "content": "Reconnaître votre qualité de journaliste et l'existence d'une enquête sur la fondation du palace.",
      "fallback": "Votre carte de presse et la photographie de la plaque sont découvertes en fin d'acte."
    },
    {
      "act": 2,
      "class": "mandatory",
      "deadline": "end_of_act",
      "content": "Présenter la photographie du registre citant Émile Mercier et l'incohérence du sceau du codicille.",
      "fallback": "Les deux photographies sont ajoutées au dossier collectif."
    },
    {
      "act": 3,
      "class": "mandatory",
      "deadline": "before_ballots",
      "content": "Révéler que l'acte complet a été demandé et qu'Auguste voulait exposer la fraude comme suspendre la vente.",
      "fallback": "La note de votre source est publiée."
    }
  ],
  "variant_transfer": {
    "standard_6_players": [
      "photographie du registre de 1919",
      "photographie de l'ancienne plaque",
      "note anonyme sur l'annexe disparue",
      "analyse du sceau du codicille"
    ]
  },
  "finale": {
    "epilogue": "Votre article rendra son nom à Émile Mercier, mais révélera aussi vos méthodes d'enquête illégales.",
    "personal_success": "Vous réunissez des preuves publiables sans révéler votre source ni inventer un crime ancien."
  }
}
